<?xml version="1.0"?><Module xmlns="http://clafer.org/ir" xmlns:xsi="http://www.w3.org/2001/XMLSchema-instance" xmlns:cl="http://clafer.org/ir" xsi:schemaLocation="http://clafer.org/ir https://github.com/gsdlab/clafer/blob/master/src/ClaferIR.xsd"><Name></Name>
<Declaration xsi:type="cl:IClafer"><Position><Start><IntLiteral>3</IntLiteral>
<IntLiteral>1</IntLiteral>
</Start>
<End><IntLiteral>5</IntLiteral>
<IntLiteral>10</IntLiteral>
</End>
</Position>
<IsAbstract>false</IsAbstract>
<GroupCard><IsKeyword>false</IsKeyword>
<Interval><Min><IntLiteral>0</IntLiteral>
</Min>
<Max><IntLiteral>-1</IntLiteral>
</Max>
</Interval>
</GroupCard>
<Id>a</Id>
<UniqueId>c1_a</UniqueId>
<Supers><IsOverlapping>false</IsOverlapping>
<Super><Type xsi:type="cl:ISet" /><ParentId></ParentId>
<Position><Start><IntLiteral>0</IntLiteral>
<IntLiteral>0</IntLiteral>
</Start>
<End><IntLiteral>0</IntLiteral>
<IntLiteral>0</IntLiteral>
</End>
</Position>
<Exp xsi:type="cl:IClaferId"><ModuleName></ModuleName>
<Id>clafer</Id>
<IsTop>false</IsTop>
</Exp></Super>
</Supers>
<Card><Min><IntLiteral>1</IntLiteral>
</Min>
<Max><IntLiteral>1</IntLiteral>
</Max>
</Card>
<GlobalCard><Min><IntLiteral>1</IntLiteral>
</Min>
<Max><IntLiteral>1</IntLiteral>
</Max>
</GlobalCard>
<Declaration xsi:type="cl:IClafer"><Position><Start><IntLiteral>4</IntLiteral>
<IntLiteral>4</IntLiteral>
</Start>
<End><IntLiteral>4</IntLiteral>
<IntLiteral>7</IntLiteral>
</End>
</Position>
<IsAbstract>false</IsAbstract>
<GroupCard><IsKeyword>false</IsKeyword>
<Interval><Min><IntLiteral>0</IntLiteral>
</Min>
<Max><IntLiteral>-1</IntLiteral>
</Max>
</Interval>
</GroupCard>
<Id>b</Id>
<UniqueId>c2_b</UniqueId>
<Supers><IsOverlapping>false</IsOverlapping>
<Super><Type xsi:type="cl:ISet" /><ParentId></ParentId>
<Position><Start><IntLiteral>0</IntLiteral>
<IntLiteral>0</IntLiteral>
</Start>
<End><IntLiteral>0</IntLiteral>
<IntLiteral>0</IntLiteral>
</End>
</Position>
<Exp xsi:type="cl:IClaferId"><ModuleName></ModuleName>
<Id>clafer</Id>
<IsTop>false</IsTop>
</Exp></Super>
</Supers>
<Card><Min><IntLiteral>0</IntLiteral>
</Min>
<Max><IntLiteral>1</IntLiteral>
</Max>
</Card>
<GlobalCard><Min><IntLiteral>0</IntLiteral>
</Min>
<Max><IntLiteral>1</IntLiteral>
</Max>
</GlobalCard>
</Declaration><Declaration xsi:type="cl:IClafer"><Position><Start><IntLiteral>5</IntLiteral>
<IntLiteral>4</IntLiteral>
</Start>
<End><IntLiteral>5</IntLiteral>
<IntLiteral>10</IntLiteral>
</End>
</Position>
<IsAbstract>false</IsAbstract>
<GroupCard><IsKeyword>false</IsKeyword>
<Interval><Min><IntLiteral>0</IntLiteral>
</Min>
<Max><IntLiteral>-1</IntLiteral>
</Max>
</Interval>
</GroupCard>
<Id>c</Id>
<UniqueId>c3_c</UniqueId>
<Supers><IsOverlapping>false</IsOverlapping>
<Super><Type xsi:type="cl:ISet" /><ParentId></ParentId>
<Position><Start><IntLiteral>0</IntLiteral>
<IntLiteral>0</IntLiteral>
</Start>
<End><IntLiteral>0</IntLiteral>
<IntLiteral>0</IntLiteral>
</End>
</Position>
<Exp xsi:type="cl:IClaferId"><ModuleName></ModuleName>
<Id>clafer</Id>
<IsTop>false</IsTop>
</Exp></Super>
</Supers>
<Card><Min><IntLiteral>2</IntLiteral>
</Min>
<Max><IntLiteral>-1</IntLiteral>
</Max>
</Card>
<GlobalCard><Min><IntLiteral>2</IntLiteral>
</Min>
<Max><IntLiteral>-1</IntLiteral>
</Max>
</GlobalCard>
</Declaration></Declaration><Declaration xsi:type="cl:IClafer"><Position><Start><IntLiteral>6</IntLiteral>
<IntLiteral>1</IntLiteral>
</Start>
<End><IntLiteral>6</IntLiteral>
<IntLiteral>4</IntLiteral>
</End>
</Position>
<IsAbstract>false</IsAbstract>
<GroupCard><IsKeyword>false</IsKeyword>
<Interval><Min><IntLiteral>0</IntLiteral>
</Min>
<Max><IntLiteral>-1</IntLiteral>
</Max>
</Interval>
</GroupCard>
<Id>d</Id>
<UniqueId>c4_d</UniqueId>
<Supers><IsOverlapping>false</IsOverlapping>
<Super><Type xsi:type="cl:ISet" /><ParentId></ParentId>
<Position><Start><IntLiteral>0</IntLiteral>
<IntLiteral>0</IntLiteral>
</Start>
<End><IntLiteral>0</IntLiteral>
<IntLiteral>0</IntLiteral>
</End>
</Position>
<Exp xsi:type="cl:IClaferId"><ModuleName></ModuleName>
<Id>clafer</Id>
<IsTop>false</IsTop>
</Exp></Super>
</Supers>
<Card><Min><IntLiteral>1</IntLiteral>
</Min>
<Max><IntLiteral>-1</IntLiteral>
</Max>
</Card>
<GlobalCard><Min><IntLiteral>1</IntLiteral>
</Min>
<Max><IntLiteral>-1</IntLiteral>
</Max>
</GlobalCard>
</Declaration><Declaration xsi:type="cl:IClafer"><Position><Start><IntLiteral>7</IntLiteral>
<IntLiteral>1</IntLiteral>
</Start>
<End><IntLiteral>7</IntLiteral>
<IntLiteral>4</IntLiteral>
</End>
</Position>
<IsAbstract>false</IsAbstract>
<GroupCard><IsKeyword>false</IsKeyword>
<Interval><Min><IntLiteral>0</IntLiteral>
</Min>
<Max><IntLiteral>-1</IntLiteral>
</Max>
</Interval>
</GroupCard>
<Id>e</Id>
<UniqueId>c5_e</UniqueId>
<Supers><IsOverlapping>false</IsOverlapping>
<Super><Type xsi:type="cl:ISet" /><ParentId></ParentId>
<Position><Start><IntLiteral>0</IntLiteral>
<IntLiteral>0</IntLiteral>
</Start>
<End><IntLiteral>0</IntLiteral>
<IntLiteral>0</IntLiteral>
</End>
</Position>
<Exp xsi:type="cl:IClaferId"><ModuleName></ModuleName>
<Id>clafer</Id>
<IsTop>false</IsTop>
</Exp></Super>
</Supers>
<Card><Min><IntLiteral>0</IntLiteral>
</Min>
<Max><IntLiteral>-1</IntLiteral>
</Max>
</Card>
<GlobalCard><Min><IntLiteral>0</IntLiteral>
</Min>
<Max><IntLiteral>-1</IntLiteral>
</Max>
</GlobalCard>
</Declaration><Declaration xsi:type="cl:IClafer"><Position><Start><IntLiteral>8</IntLiteral>
<IntLiteral>1</IntLiteral>
</Start>
<End><IntLiteral>8</IntLiteral>
<IntLiteral>4</IntLiteral>
</End>
</Position>
<IsAbstract>false</IsAbstract>
<GroupCard><IsKeyword>false</IsKeyword>
<Interval><Min><IntLiteral>0</IntLiteral>
</Min>
<Max><IntLiteral>-1</IntLiteral>
</Max>
</Interval>
</GroupCard>
<Id>f</Id>
<UniqueId>c6_f</UniqueId>
<Supers><IsOverlapping>false</IsOverlapping>
<Super><Type xsi:type="cl:ISet" /><ParentId></ParentId>
<Position><Start><IntLiteral>0</IntLiteral>
<IntLiteral>0</IntLiteral>
</Start>
<End><IntLiteral>0</IntLiteral>
<IntLiteral>0</IntLiteral>
</End>
</Position>
<Exp xsi:type="cl:IClaferId"><ModuleName></ModuleName>
<Id>clafer</Id>
<IsTop>false</IsTop>
</Exp></Super>
</Supers>
<Card><Min><IntLiteral>0</IntLiteral>
</Min>
<Max><IntLiteral>0</IntLiteral>
</Max>
</Card>
<GlobalCard><Min><IntLiteral>0</IntLiteral>
</Min>
<Max><IntLiteral>0</IntLiteral>
</Max>
</GlobalCard>
</Declaration></Module>