<?xml version="1.0"?><Module xmlns="http://clafer.org/ir" xmlns:xsi="http://www.w3.org/2001/XMLSchema-instance" xmlns:cl="http://clafer.org/ir" xsi:schemaLocation="http://clafer.org/ir https://github.com/gsdlab/clafer/blob/master/src/ClaferIR.xsd"><Name></Name>
<Declaration xsi:type="cl:IClafer"><Position><Start><IntLiteral>8</IntLiteral>
<IntLiteral>1</IntLiteral>
</Start>
<End><IntLiteral>8</IntLiteral>
<IntLiteral>6</IntLiteral>
</End>
</Position>
<IsAbstract>false</IsAbstract>
<GroupCard><IsKeyword>false</IsKeyword>
<Interval><Min><IntLiteral>0</IntLiteral>
</Min>
<Max><IntLiteral>-1</IntLiteral>
</Max>
</Interval>
</GroupCard>
<Id>A</Id>
<UniqueId>c1_A</UniqueId>
<Supers><IsOverlapping>false</IsOverlapping>
<Super><Type xsi:type="cl:ISet" /><ParentId></ParentId>
<Position><Start><IntLiteral>8</IntLiteral>
<IntLiteral>5</IntLiteral>
</Start>
<End><IntLiteral>8</IntLiteral>
<IntLiteral>6</IntLiteral>
</End>
</Position>
<Exp xsi:type="cl:IClaferId"><ModuleName></ModuleName>
<Id>c2_B</Id>
<IsTop>true</IsTop>
</Exp></Super>
</Supers>
<Card><Min><IntLiteral>0</IntLiteral>
</Min>
<Max><IntLiteral>1</IntLiteral>
</Max>
</Card>
<GlobalCard><Min><IntLiteral>0</IntLiteral>
</Min>
<Max><IntLiteral>1</IntLiteral>
</Max>
</GlobalCard>
</Declaration><Declaration xsi:type="cl:IClafer"><Position><Start><IntLiteral>9</IntLiteral>
<IntLiteral>1</IntLiteral>
</Start>
<End><IntLiteral>9</IntLiteral>
<IntLiteral>11</IntLiteral>
</End>
</Position>
<IsAbstract>true</IsAbstract>
<GroupCard><IsKeyword>false</IsKeyword>
<Interval><Min><IntLiteral>0</IntLiteral>
</Min>
<Max><IntLiteral>-1</IntLiteral>
</Max>
</Interval>
</GroupCard>
<Id>B</Id>
<UniqueId>c2_B</UniqueId>
<Supers><IsOverlapping>false</IsOverlapping>
<Super><Type xsi:type="cl:ISet" /><ParentId></ParentId>
<Position><Start><IntLiteral>0</IntLiteral>
<IntLiteral>0</IntLiteral>
</Start>
<End><IntLiteral>0</IntLiteral>
<IntLiteral>0</IntLiteral>
</End>
</Position>
<Exp xsi:type="cl:IClaferId"><ModuleName></ModuleName>
<Id>clafer</Id>
<IsTop>false</IsTop>
</Exp></Super>
</Supers>
<Card><Min><IntLiteral>0</IntLiteral>
</Min>
<Max><IntLiteral>-1</IntLiteral>
</Max>
</Card>
<GlobalCard><Min><IntLiteral>0</IntLiteral>
</Min>
<Max><IntLiteral>-1</IntLiteral>
</Max>
</GlobalCard>
</Declaration></Module>