<?xml version="1.0"?><Module xmlns="http://clafer.org/ir" xmlns:xsi="http://www.w3.org/2001/XMLSchema-instance" xmlns:cl="http://clafer.org/ir" xsi:schemaLocation="http://clafer.org/ir https://github.com/gsdlab/clafer/blob/master/src/ClaferIR.xsd"><Name></Name>
<Declaration xsi:type="cl:IClafer"><Position><Start><IntLiteral>3</IntLiteral>
<IntLiteral>1</IntLiteral>
</Start>
<End><IntLiteral>8</IntLiteral>
<IntLiteral>8</IntLiteral>
</End>
</Position>
<IsAbstract>false</IsAbstract>
<GroupCard><IsKeyword>false</IsKeyword>
<Interval><Min><IntLiteral>0</IntLiteral>
</Min>
<Max><IntLiteral>-1</IntLiteral>
</Max>
</Interval>
</GroupCard>
<Id>D</Id>
<UniqueId>c1_D</UniqueId>
<Supers><IsOverlapping>false</IsOverlapping>
<Super><Type xsi:type="cl:ISet" /><ParentId></ParentId>
<Position><Start><IntLiteral>0</IntLiteral>
<IntLiteral>0</IntLiteral>
</Start>
<End><IntLiteral>0</IntLiteral>
<IntLiteral>0</IntLiteral>
</End>
</Position>
<Exp xsi:type="cl:IClaferId"><ModuleName></ModuleName>
<Id>clafer</Id>
<IsTop>false</IsTop>
</Exp></Super>
</Supers>
<Card><Min><IntLiteral>1</IntLiteral>
</Min>
<Max><IntLiteral>1</IntLiteral>
</Max>
</Card>
<GlobalCard><Min><IntLiteral>1</IntLiteral>
</Min>
<Max><IntLiteral>1</IntLiteral>
</Max>
</GlobalCard>
<Declaration xsi:type="cl:IClafer"><Position><Start><IntLiteral>4</IntLiteral>
<IntLiteral>5</IntLiteral>
</Start>
<End><IntLiteral>4</IntLiteral>
<IntLiteral>8</IntLiteral>
</End>
</Position>
<IsAbstract>false</IsAbstract>
<GroupCard><IsKeyword>false</IsKeyword>
<Interval><Min><IntLiteral>0</IntLiteral>
</Min>
<Max><IntLiteral>-1</IntLiteral>
</Max>
</Interval>
</GroupCard>
<Id>b</Id>
<UniqueId>c2_b</UniqueId>
<Supers><IsOverlapping>false</IsOverlapping>
<Super><Type xsi:type="cl:ISet" /><ParentId></ParentId>
<Position><Start><IntLiteral>0</IntLiteral>
<IntLiteral>0</IntLiteral>
</Start>
<End><IntLiteral>0</IntLiteral>
<IntLiteral>0</IntLiteral>
</End>
</Position>
<Exp xsi:type="cl:IClaferId"><ModuleName></ModuleName>
<Id>clafer</Id>
<IsTop>false</IsTop>
</Exp></Super>
</Supers>
<Card><Min><IntLiteral>0</IntLiteral>
</Min>
<Max><IntLiteral>1</IntLiteral>
</Max>
</Card>
<GlobalCard><Min><IntLiteral>0</IntLiteral>
</Min>
<Max><IntLiteral>1</IntLiteral>
</Max>
</GlobalCard>
</Declaration><Declaration xsi:type="cl:IClafer"><Position><Start><IntLiteral>5</IntLiteral>
<IntLiteral>5</IntLiteral>
</Start>
<End><IntLiteral>5</IntLiteral>
<IntLiteral>18</IntLiteral>
</End>
</Position>
<IsAbstract>false</IsAbstract>
<GroupCard><IsKeyword>false</IsKeyword>
<Interval><Min><IntLiteral>0</IntLiteral>
</Min>
<Max><IntLiteral>-1</IntLiteral>
</Max>
</Interval>
</GroupCard>
<Id>c</Id>
<UniqueId>c3_c</UniqueId>
<Supers><IsOverlapping>false</IsOverlapping>
<Super><ParentId>integer_((5,9),(5,16))</ParentId>
<Position><Start><IntLiteral>5</IntLiteral>
<IntLiteral>9</IntLiteral>
</Start>
<End><IntLiteral>5</IntLiteral>
<IntLiteral>16</IntLiteral>
</End>
</Position>
<Exp xsi:type="cl:IClaferId"><ModuleName></ModuleName>
<Id>integer</Id>
<IsTop>true</IsTop>
</Exp></Super>
</Supers>
<Card><Min><IntLiteral>0</IntLiteral>
</Min>
<Max><IntLiteral>1</IntLiteral>
</Max>
</Card>
<GlobalCard><Min><IntLiteral>0</IntLiteral>
</Min>
<Max><IntLiteral>1</IntLiteral>
</Max>
</GlobalCard>
</Declaration><Declaration xsi:type="cl:IConstraint"><IsHard>true</IsHard>
<ParentExp><Type xsi:type="cl:IBoolean" /><ParentId>=_((6,6),(6,11))</ParentId>
<Position><Start><IntLiteral>6</IntLiteral>
<IntLiteral>6</IntLiteral>
</Start>
<End><IntLiteral>6</IntLiteral>
<IntLiteral>11</IntLiteral>
</End>
</Position>
<Exp xsi:type="cl:IFunctionExp"><Operation>=</Operation>
<Argument><Type xsi:type="cl:IInteger" /><ParentId>c_((6,6),(6,7))</ParentId>
<Position><Start><IntLiteral>6</IntLiteral>
<IntLiteral>6</IntLiteral>
</Start>
<End><IntLiteral>6</IntLiteral>
<IntLiteral>7</IntLiteral>
</End>
</Position>
<Exp xsi:type="cl:IFunctionExp"><Operation>.</Operation>
<Argument><Type xsi:type="cl:ISet" /><ParentId></ParentId>
<Position><Start><IntLiteral>0</IntLiteral>
<IntLiteral>0</IntLiteral>
</Start>
<End><IntLiteral>0</IntLiteral>
<IntLiteral>0</IntLiteral>
</End>
</Position>
<Exp xsi:type="cl:IClaferId"><ModuleName></ModuleName>
<Id>this</Id>
<IsTop>true</IsTop>
</Exp></Argument>
<Argument><Type xsi:type="cl:IInteger" /><ParentId></ParentId>
<Position><Start><IntLiteral>0</IntLiteral>
<IntLiteral>0</IntLiteral>
</Start>
<End><IntLiteral>0</IntLiteral>
<IntLiteral>0</IntLiteral>
</End>
</Position>
<Exp xsi:type="cl:IFunctionExp"><Operation>.</Operation>
<Argument><Type xsi:type="cl:ISet" /><ParentId></ParentId>
<Position><Start><IntLiteral>0</IntLiteral>
<IntLiteral>0</IntLiteral>
</Start>
<End><IntLiteral>0</IntLiteral>
<IntLiteral>0</IntLiteral>
</End>
</Position>
<Exp xsi:type="cl:IClaferId"><ModuleName></ModuleName>
<Id>c3_c</Id>
<IsTop>false</IsTop>
</Exp></Argument>
<Argument><Type xsi:type="cl:IInteger" /><ParentId></ParentId>
<Position><Start><IntLiteral>0</IntLiteral>
<IntLiteral>0</IntLiteral>
</Start>
<End><IntLiteral>0</IntLiteral>
<IntLiteral>0</IntLiteral>
</End>
</Position>
<Exp xsi:type="cl:IClaferId"><ModuleName></ModuleName>
<Id>ref</Id>
<IsTop>false</IsTop>
</Exp></Argument>
</Exp></Argument>
</Exp></Argument>
<Argument><Type xsi:type="cl:IInteger" /><ParentId>5_((6,10),(6,11))</ParentId>
<Position><Start><IntLiteral>6</IntLiteral>
<IntLiteral>10</IntLiteral>
</Start>
<End><IntLiteral>6</IntLiteral>
<IntLiteral>11</IntLiteral>
</End>
</Position>
<Exp xsi:type="cl:IIntExp"><IntLiteral>5</IntLiteral>
</Exp></Argument>
</Exp></ParentExp>
</Declaration><Declaration xsi:type="cl:IConstraint"><IsHard>true</IsHard>
<ParentExp><Type xsi:type="cl:IBoolean" /><ParentId>=_((7,6),(7,11))</ParentId>
<Position><Start><IntLiteral>7</IntLiteral>
<IntLiteral>6</IntLiteral>
</Start>
<End><IntLiteral>7</IntLiteral>
<IntLiteral>11</IntLiteral>
</End>
</Position>
<Exp xsi:type="cl:IFunctionExp"><Operation>=</Operation>
<Argument><Type xsi:type="cl:IInteger" /><ParentId>c_((7,6),(7,7))</ParentId>
<Position><Start><IntLiteral>7</IntLiteral>
<IntLiteral>6</IntLiteral>
</Start>
<End><IntLiteral>7</IntLiteral>
<IntLiteral>7</IntLiteral>
</End>
</Position>
<Exp xsi:type="cl:IFunctionExp"><Operation>.</Operation>
<Argument><Type xsi:type="cl:ISet" /><ParentId></ParentId>
<Position><Start><IntLiteral>0</IntLiteral>
<IntLiteral>0</IntLiteral>
</Start>
<End><IntLiteral>0</IntLiteral>
<IntLiteral>0</IntLiteral>
</End>
</Position>
<Exp xsi:type="cl:IClaferId"><ModuleName></ModuleName>
<Id>this</Id>
<IsTop>true</IsTop>
</Exp></Argument>
<Argument><Type xsi:type="cl:IInteger" /><ParentId></ParentId>
<Position><Start><IntLiteral>0</IntLiteral>
<IntLiteral>0</IntLiteral>
</Start>
<End><IntLiteral>0</IntLiteral>
<IntLiteral>0</IntLiteral>
</End>
</Position>
<Exp xsi:type="cl:IFunctionExp"><Operation>.</Operation>
<Argument><Type xsi:type="cl:ISet" /><ParentId></ParentId>
<Position><Start><IntLiteral>0</IntLiteral>
<IntLiteral>0</IntLiteral>
</Start>
<End><IntLiteral>0</IntLiteral>
<IntLiteral>0</IntLiteral>
</End>
</Position>
<Exp xsi:type="cl:IClaferId"><ModuleName></ModuleName>
<Id>c3_c</Id>
<IsTop>false</IsTop>
</Exp></Argument>
<Argument><Type xsi:type="cl:IInteger" /><ParentId></ParentId>
<Position><Start><IntLiteral>0</IntLiteral>
<IntLiteral>0</IntLiteral>
</Start>
<End><IntLiteral>0</IntLiteral>
<IntLiteral>0</IntLiteral>
</End>
</Position>
<Exp xsi:type="cl:IClaferId"><ModuleName></ModuleName>
<Id>ref</Id>
<IsTop>false</IsTop>
</Exp></Argument>
</Exp></Argument>
</Exp></Argument>
<Argument><Type xsi:type="cl:IInteger" /><ParentId>5_((7,10),(7,11))</ParentId>
<Position><Start><IntLiteral>7</IntLiteral>
<IntLiteral>10</IntLiteral>
</Start>
<End><IntLiteral>7</IntLiteral>
<IntLiteral>11</IntLiteral>
</End>
</Position>
<Exp xsi:type="cl:IIntExp"><IntLiteral>5</IntLiteral>
</Exp></Argument>
</Exp></ParentExp>
</Declaration><Declaration xsi:type="cl:IConstraint"><IsHard>true</IsHard>
<ParentExp><Type xsi:type="cl:IBoolean" /><ParentId>ISome_((8,7),(8,8))</ParentId>
<Position><Start><IntLiteral>8</IntLiteral>
<IntLiteral>7</IntLiteral>
</Start>
<End><IntLiteral>8</IntLiteral>
<IntLiteral>8</IntLiteral>
</End>
</Position>
<Exp xsi:type="cl:IDeclarationParentExp"><Quantifier xsi:type="cl:ISome" /><BodyParentExp><Type xsi:type="cl:ISet" /><ParentId>b_((8,7),(8,8))</ParentId>
<Position><Start><IntLiteral>8</IntLiteral>
<IntLiteral>7</IntLiteral>
</Start>
<End><IntLiteral>8</IntLiteral>
<IntLiteral>8</IntLiteral>
</End>
</Position>
<Exp xsi:type="cl:IFunctionExp"><Operation>.</Operation>
<Argument><Type xsi:type="cl:ISet" /><ParentId></ParentId>
<Position><Start><IntLiteral>0</IntLiteral>
<IntLiteral>0</IntLiteral>
</Start>
<End><IntLiteral>0</IntLiteral>
<IntLiteral>0</IntLiteral>
</End>
</Position>
<Exp xsi:type="cl:IClaferId"><ModuleName></ModuleName>
<Id>this</Id>
<IsTop>true</IsTop>
</Exp></Argument>
<Argument><Type xsi:type="cl:ISet" /><ParentId></ParentId>
<Position><Start><IntLiteral>0</IntLiteral>
<IntLiteral>0</IntLiteral>
</Start>
<End><IntLiteral>0</IntLiteral>
<IntLiteral>0</IntLiteral>
</End>
</Position>
<Exp xsi:type="cl:IClaferId"><ModuleName></ModuleName>
<Id>c2_b</Id>
<IsTop>false</IsTop>
</Exp></Argument>
</Exp></BodyParentExp>
</Exp></ParentExp>
</Declaration></Declaration></Module>