<?xml version="1.0"?><Module xmlns="http://clafer.org/ir" xmlns:xsi="http://www.w3.org/2001/XMLSchema-instance" xmlns:cl="http://clafer.org/ir" xsi:schemaLocation="http://clafer.org/ir https://github.com/gsdlab/clafer/blob/master/src/ClaferIR.xsd"><Name></Name>
<Declaration xsi:type="cl:IClafer"><Position><Start><IntLiteral>1</IntLiteral>
<IntLiteral>1</IntLiteral>
</Start>
<End><IntLiteral>2</IntLiteral>
<IntLiteral>31</IntLiteral>
</End>
</Position>
<IsAbstract>true</IsAbstract>
<GroupCard><IsKeyword>false</IsKeyword>
<Interval><Min><IntLiteral>0</IntLiteral>
</Min>
<Max><IntLiteral>-1</IntLiteral>
</Max>
</Interval>
</GroupCard>
<Id>Measurable</Id>
<UniqueId>c1_Measurable</UniqueId>
<Supers><IsOverlapping>false</IsOverlapping>
<Super><Type xsi:type="cl:ISet" /><ParentId></ParentId>
<Position><Start><IntLiteral>0</IntLiteral>
<IntLiteral>0</IntLiteral>
</Start>
<End><IntLiteral>0</IntLiteral>
<IntLiteral>0</IntLiteral>
</End>
</Position>
<Exp xsi:type="cl:IClaferId"><ModuleName></ModuleName>
<Id>clafer</Id>
<IsTop>false</IsTop>
</Exp></Super>
</Supers>
<Card><Min><IntLiteral>0</IntLiteral>
</Min>
<Max><IntLiteral>-1</IntLiteral>
</Max>
</Card>
<GlobalCard><Min><IntLiteral>0</IntLiteral>
</Min>
<Max><IntLiteral>-1</IntLiteral>
</Max>
</GlobalCard>
<Declaration xsi:type="cl:IClafer"><Position><Start><IntLiteral>2</IntLiteral>
<IntLiteral>10</IntLiteral>
</Start>
<End><IntLiteral>2</IntLiteral>
<IntLiteral>31</IntLiteral>
</End>
</Position>
<IsAbstract>false</IsAbstract>
<GroupCard><IsKeyword>false</IsKeyword>
<Interval><Min><IntLiteral>0</IntLiteral>
</Min>
<Max><IntLiteral>-1</IntLiteral>
</Max>
</Interval>
</GroupCard>
<Id>performance</Id>
<UniqueId>c2_performance</UniqueId>
<Supers><IsOverlapping>false</IsOverlapping>
<Super><ParentId>integer_((2,24),(2,31))</ParentId>
<Position><Start><IntLiteral>2</IntLiteral>
<IntLiteral>24</IntLiteral>
</Start>
<End><IntLiteral>2</IntLiteral>
<IntLiteral>31</IntLiteral>
</End>
</Position>
<Exp xsi:type="cl:IClaferId"><ModuleName></ModuleName>
<Id>integer</Id>
<IsTop>true</IsTop>
</Exp></Super>
</Supers>
<Card><Min><IntLiteral>1</IntLiteral>
</Min>
<Max><IntLiteral>1</IntLiteral>
</Max>
</Card>
<GlobalCard><Min><IntLiteral>0</IntLiteral>
</Min>
<Max><IntLiteral>-1</IntLiteral>
</Max>
</GlobalCard>
</Declaration></Declaration><Declaration xsi:type="cl:IClafer"><Position><Start><IntLiteral>4</IntLiteral>
<IntLiteral>1</IntLiteral>
</Start>
<End><IntLiteral>4</IntLiteral>
<IntLiteral>14</IntLiteral>
</End>
</Position>
<IsAbstract>false</IsAbstract>
<GroupCard><IsKeyword>false</IsKeyword>
<Interval><Min><IntLiteral>0</IntLiteral>
</Min>
<Max><IntLiteral>-1</IntLiteral>
</Max>
</Interval>
</GroupCard>
<Id>D</Id>
<UniqueId>c3_D</UniqueId>
<Supers><IsOverlapping>false</IsOverlapping>
<Super><Type xsi:type="cl:ISet" /><ParentId>Measurable_((4,4),(4,14))</ParentId>
<Position><Start><IntLiteral>4</IntLiteral>
<IntLiteral>4</IntLiteral>
</Start>
<End><IntLiteral>4</IntLiteral>
<IntLiteral>14</IntLiteral>
</End>
</Position>
<Exp xsi:type="cl:IClaferId"><ModuleName></ModuleName>
<Id>c1_Measurable</Id>
<IsTop>true</IsTop>
</Exp></Super>
</Supers>
<Card><Min><IntLiteral>0</IntLiteral>
</Min>
<Max><IntLiteral>1</IntLiteral>
</Max>
</Card>
<GlobalCard><Min><IntLiteral>0</IntLiteral>
</Min>
<Max><IntLiteral>1</IntLiteral>
</Max>
</GlobalCard>
</Declaration><Declaration xsi:type="cl:IClafer"><Position><Start><IntLiteral>6</IntLiteral>
<IntLiteral>1</IntLiteral>
</Start>
<End><IntLiteral>6</IntLiteral>
<IntLiteral>13</IntLiteral>
</End>
</Position>
<IsAbstract>false</IsAbstract>
<GroupCard><IsKeyword>false</IsKeyword>
<Interval><Min><IntLiteral>0</IntLiteral>
</Min>
<Max><IntLiteral>-1</IntLiteral>
</Max>
</Interval>
</GroupCard>
<Id>C</Id>
<UniqueId>c4_C</UniqueId>
<Supers><IsOverlapping>false</IsOverlapping>
<Super><Type xsi:type="cl:ISet" /><ParentId>Measurable_((6,3),(6,13))</ParentId>
<Position><Start><IntLiteral>6</IntLiteral>
<IntLiteral>3</IntLiteral>
</Start>
<End><IntLiteral>6</IntLiteral>
<IntLiteral>13</IntLiteral>
</End>
</Position>
<Exp xsi:type="cl:IClaferId"><ModuleName></ModuleName>
<Id>c1_Measurable</Id>
<IsTop>true</IsTop>
</Exp></Super>
</Supers>
<Card><Min><IntLiteral>0</IntLiteral>
</Min>
<Max><IntLiteral>1</IntLiteral>
</Max>
</Card>
<GlobalCard><Min><IntLiteral>0</IntLiteral>
</Min>
<Max><IntLiteral>1</IntLiteral>
</Max>
</GlobalCard>
</Declaration><Declaration xsi:type="cl:IConstraint"><IsHard>true</IsHard>
<ParentExp><Type xsi:type="cl:IBoolean" /><ParentId>c5_exp</ParentId>
<Position><Start><IntLiteral>8</IntLiteral>
<IntLiteral>3</IntLiteral>
</Start>
<End><IntLiteral>8</IntLiteral>
<IntLiteral>33</IntLiteral>
</End>
</Position>
<Exp xsi:type="cl:IFunctionExp"><Operation>=</Operation>
<Argument><Type xsi:type="cl:IInteger" /><ParentId>c6_exp</ParentId>
<Position><Start><IntLiteral>8</IntLiteral>
<IntLiteral>3</IntLiteral>
</Start>
<End><IntLiteral>8</IntLiteral>
<IntLiteral>16</IntLiteral>
</End>
</Position>
<Exp xsi:type="cl:IFunctionExp"><Operation>.</Operation>
<Argument><Type xsi:type="cl:ISet" /><ParentId>c7_exp</ParentId>
<Position><Start><IntLiteral>8</IntLiteral>
<IntLiteral>3</IntLiteral>
</Start>
<End><IntLiteral>8</IntLiteral>
<IntLiteral>4</IntLiteral>
</End>
</Position>
<Exp xsi:type="cl:IClaferId"><ModuleName></ModuleName>
<Id>c4_C</Id>
<IsTop>true</IsTop>
</Exp></Argument>
<Argument><Type xsi:type="cl:IInteger" /><ParentId>._((8,5),(8,16))</ParentId>
<Position><Start><IntLiteral>8</IntLiteral>
<IntLiteral>5</IntLiteral>
</Start>
<End><IntLiteral>8</IntLiteral>
<IntLiteral>16</IntLiteral>
</End>
</Position>
<Exp xsi:type="cl:IFunctionExp"><Operation>.</Operation>
<Argument><Type xsi:type="cl:ISet" /><ParentId>c8_exp</ParentId>
<Position><Start><IntLiteral>8</IntLiteral>
<IntLiteral>5</IntLiteral>
</Start>
<End><IntLiteral>8</IntLiteral>
<IntLiteral>16</IntLiteral>
</End>
</Position>
<Exp xsi:type="cl:IClaferId"><ModuleName></ModuleName>
<Id>c2_performance</Id>
<IsTop>false</IsTop>
</Exp></Argument>
<Argument><Type xsi:type="cl:IInteger" /><ParentId>ref_((8,5),(8,16))</ParentId>
<Position><Start><IntLiteral>8</IntLiteral>
<IntLiteral>5</IntLiteral>
</Start>
<End><IntLiteral>8</IntLiteral>
<IntLiteral>16</IntLiteral>
</End>
</Position>
<Exp xsi:type="cl:IClaferId"><ModuleName></ModuleName>
<Id>ref</Id>
<IsTop>false</IsTop>
</Exp></Argument>
</Exp></Argument>
</Exp></Argument>
<Argument><Type xsi:type="cl:IInteger" /><ParentId>c9_exp</ParentId>
<Position><Start><IntLiteral>8</IntLiteral>
<IntLiteral>19</IntLiteral>
</Start>
<End><IntLiteral>8</IntLiteral>
<IntLiteral>33</IntLiteral>
</End>
</Position>
<Exp xsi:type="cl:IFunctionExp"><Operation>*</Operation>
<Argument><Type xsi:type="cl:IInteger" /><ParentId>c10_exp</ParentId>
<Position><Start><IntLiteral>8</IntLiteral>
<IntLiteral>19</IntLiteral>
</Start>
<End><IntLiteral>8</IntLiteral>
<IntLiteral>33</IntLiteral>
</End>
</Position>
<Exp xsi:type="cl:IIntExp"><IntLiteral>-1</IntLiteral>
</Exp></Argument>
<Argument><Type xsi:type="cl:IInteger" /><ParentId>c11_exp</ParentId>
<Position><Start><IntLiteral>8</IntLiteral>
<IntLiteral>20</IntLiteral>
</Start>
<End><IntLiteral>8</IntLiteral>
<IntLiteral>33</IntLiteral>
</End>
</Position>
<Exp xsi:type="cl:IFunctionExp"><Operation>.</Operation>
<Argument><Type xsi:type="cl:ISet" /><ParentId>c12_exp</ParentId>
<Position><Start><IntLiteral>8</IntLiteral>
<IntLiteral>20</IntLiteral>
</Start>
<End><IntLiteral>8</IntLiteral>
<IntLiteral>21</IntLiteral>
</End>
</Position>
<Exp xsi:type="cl:IClaferId"><ModuleName></ModuleName>
<Id>c3_D</Id>
<IsTop>true</IsTop>
</Exp></Argument>
<Argument><Type xsi:type="cl:IInteger" /><ParentId>._((8,22),(8,33))</ParentId>
<Position><Start><IntLiteral>8</IntLiteral>
<IntLiteral>22</IntLiteral>
</Start>
<End><IntLiteral>8</IntLiteral>
<IntLiteral>33</IntLiteral>
</End>
</Position>
<Exp xsi:type="cl:IFunctionExp"><Operation>.</Operation>
<Argument><Type xsi:type="cl:ISet" /><ParentId>c13_exp</ParentId>
<Position><Start><IntLiteral>8</IntLiteral>
<IntLiteral>22</IntLiteral>
</Start>
<End><IntLiteral>8</IntLiteral>
<IntLiteral>33</IntLiteral>
</End>
</Position>
<Exp xsi:type="cl:IClaferId"><ModuleName></ModuleName>
<Id>c2_performance</Id>
<IsTop>false</IsTop>
</Exp></Argument>
<Argument><Type xsi:type="cl:IInteger" /><ParentId>ref_((8,22),(8,33))</ParentId>
<Position><Start><IntLiteral>8</IntLiteral>
<IntLiteral>22</IntLiteral>
</Start>
<End><IntLiteral>8</IntLiteral>
<IntLiteral>33</IntLiteral>
</End>
</Position>
<Exp xsi:type="cl:IClaferId"><ModuleName></ModuleName>
<Id>ref</Id>
<IsTop>false</IsTop>
</Exp></Argument>
</Exp></Argument>
</Exp></Argument>
</Exp></Argument>
</Exp></ParentExp>
</Declaration></Module>